{
  "schema_version": "1.0.0",
  "event_id": "EVT-C4-0001",
  "timestamp": "2026-07-21T08:15:00Z",
  "assessment_id": "URIELLE-C4-001",
  "correlation_id": "RUN-C4-001",
  "component_id": "URIELLE-DETERMINISTIC-VALIDATOR-001",
  "component_version": "0.1.0",
  "workflow_state": "VALIDATING",
  "event_status": "SUCCEEDED",
  "step": "VALIDATE_ASSESSMENT_INPUT",
  "action": "validate_assessment_plan",
  "input_refs": [
    "assessment_plan.valid.json"
  ],
  "output_refs": [
    "validation_result:C4-001"
  ],
  "result": "Assessment plan passed deterministic schema validation.",
  "policy_decision": "ALLOWED",
  "human_review_required": false,
  "duration_ms": 12,
  "error": null,
  "provenance": {
    "created_at": "2026-07-21T08:15:00Z",
    "created_by": "Urielle-AI deterministic fixture",
    "generator": "DETERMINISTIC_RULES",
    "generator_version": "0.1.0",
    "source_refs": [
      "assessment_plan.valid.json",
      "assessment_plan.schema.json"
    ]
  }
}
